{
  "$schema": "https://codetwo.app/schemas/scenes/2.0.0/scene.schema.json",
  "id": "official:software-development",
  "version": "2.0.0",
  "title": "Software Development",
  "description": "Domain context for designing, changing, reviewing, and maintaining software.",
  "domain": "software-development",
  "localizations": {
    "zh-CN": {
      "title": "软件开发",
      "description": "用于设计、修改、评审和维护软件的领域上下文。"
    }
  },
  "provenance": {
    "kind": "official"
  },
  "agent_skill_selectors": [
    "software-development"
  ],
  "capability_namespaces": [
    "source-control",
    "workspace"
  ],
  "extensions": {}
}
